,top words,ID,Text
206,"['stfu', 'every', 'right', 'complain', 'anyone', 'else', 'fucking', 'entitled', 'brat', 'acting', 'like', 'opinion', 'fucking', 'important']",9244,stfu they have every right to complain as does anyone else you fucking entitled brat acting like your opinion is fucking important 
207,"['yeah', 'see', 'minecraft', 'getting', 'ha', 'oh', 'wait', 'minecraft', 'community', 'keeps', 'harassing', 'mojang', 'point', 'insanity', 'seriously']",9361,yeah you don’t see minecraft getting the ha oh wait the minecraft community keeps harassing mojang to the point of insanity seriously don’t do that 
208,"['minecraft', 'looks', 'way', 'artstyle']",9363,but minecraft looks that way because of its artstyle
209,['clueless'],9400,clueless
210,"['forgot', 'silent', 'hill']",9617,you forgot silent hill 
211,"['better', 'metaverse']",9624,better than the metaverse 
212,"['word', 'profitable', 'would', 'gave', 'away', 'easily']",9670,the word 'profitable' would have gave it away easily 
213,"['joke', 'would', 'metaverse', 'profitable', 'lol']",9671,the only joke there would be the metaverse being profitable lol 
214,"['title', 'says', 'profitable', 'metaverse', 'hemorrhaging', 'millions']",9672,the title says most profitable metaverse is hemorrhaging millions
215,"['obviously', 'operative', 'word', 'profitable', 'giant', 'pit', 'burn', 'cash']",9673,obviously not with the operative word being ‘profitable’ and not ‘giant pit to burn your cash in’
216,"['nah', 'legs']",9677,nah there are legs
217,"['title', 'say', 'profitable', 'meta', 'metaverse']",9680,the title does say most profitable which meta or the metaverse is not
218,"['thought', 'minecraft', 'something']",9695,i thought it was minecraft or something
219,"['forget', 'botw']",9703,don't forget botw 
220,"['forget', 'mario', 'rabbids']",9721,don't forget mario+rabbids
221,"['runs', 'doom', 'eternal', 'haha']",9739,it runs doom eternal haha
222,"['black', 'white', 'dogshit']",9849,black and white is dogshit what are you on about
223,"['fuck', 'pre', 'ordering', 'pre', 'ordering', 'two']",9990,fuck not just pre ordering them pre ordering two 
224,"['bomb', 'harbor']",10024,“bomb the harbor ”
225,"['mod', 'game', 'modders', 'wonders', 'dp', 'remakes']",10040,you will if you mod the game = modders are doing wonders with the dp remakes
226,"['haha', 'true']",10241,haha so true
227,"['say', 'go', 'cel', 'shaded', 'like', 'wind', 'waker', 'steer', 'art', 'style', 'toward', 'cartoon']",10325,i say go cel shaded like wind waker but steer the art style toward the cartoon 
228,"['wondering', 'next', 'would', 'titled', 'profitable']",10382,no and that's what i was wondering about next how it would be titled as profitable 
229,['fr'],10415,fr
230,"['forget', 'crisis', 'trilogy', 'alien', 'isolation', 'metro']",10441,don't forget the crisis trilogy alien isolation and metro 
231,"['fuck', 'dude']",10509,what the fuck dude 
232,"['bruh', 'gen', 'like', 'liked', 'lmao']",10581,bruh gen is like the most liked lmao
233,"['two', 'every', 'decade', 'hyperbolic', 'hell', 'gow', 'witcher', 'bloodborne', 'elden', 'ring', 'tlou', 'spider', 'man', 'red', 'dead', 'redemption', 'disco', 'elysium', 'breath', 'wild', 'mario', 'odyssey', 'nier', 'last', 'ten', 'years', 'go', 'years', 'portal', 'mass', 'effect', 'uncharted', 'arkham', 'asylum', 'like', 'real', 'hell', 'talking', 'lmao']",10831,two every decade that’s hyperbolic as hell gow & the witcher bloodborne elden ring tlou spider man red dead redemption disco elysium breath of the wild mario odyssey nier in the last ten years if you go years you get portal mass effect uncharted arkham asylum… like for real what the hell are you talking about lmao
234,['eternal'],10966,and eternal 
235,"['doom', 'eternal']",10981,and doom eternal 
236,"['forget', 'knack']",11005,how did you forget knack 
237,"['wii', 'overclocked', 'wii', 'touch', 'screen', 'overclocked', 'gamecube', 'motion', 'waggle', 'controls']",11006,the wii u was just an overclocked wii with a touch screen which was just an overclocked gamecube with ~~motion~~ waggle controls 
238,"['show', 'power']",11009,how show me this power
239,"['wait', 'ark', 'switch']",11016,wait what there's ark on switch 
240,"['fuck', 'yeah']",11044,fuck yeah
241,['true'],11072,so true
242,"['dodge', 'lightning', 'bolts', 'friend', 'could', 'never', 'one', 'successfully']",11181,dodge those lightning bolts friend i could never get that one successfully
243,"['like', 'game', 'dont', 'fucks', 'sakes', 'social', 'media', 'die', 'already']",11245,i like this game no you dont for fucks sakes can social media just die already
244,"['wait', 'couple', 'weeks', 'itching', 'hard', 'whine', 'something']",11304,it’s both just wait a couple weeks or are you itching that hard to whine about something 
245,"['ok', 'good', 'enough', 'power', 'ya']",11345,ok if that’s good enough for you then all power to ya 
246,"['wait', 'ported', 'eternal']",11402,wait they ported eternal too 
247,"['botw', 'mk', 'deluxe']",11403,and botw and mk deluxe
248,"['true', 'wii', 'roughly', 'core', 'cpu', 'ram', 'faster', 'gpu', 'edit', 'developing', 'architecture', 'yes', 'raw', 'power', 'system', 'stronger', 'wii', 'quite', 'bit', 'sure', 'guy', 'going', 'much']",11437,not true at all the wii u was roughly a it had a core cpu in it and more ram faster gpu edit the developing architecture is the same yes but the raw power of the system is stronger than the wii by quite a bit not sure why this guy is going so much about this 
249,"['anthem', 'avengers', 'good', 'minecraft', 'ffxiv', 'bad', 'gotcha']",11496,so anthem and avengers good minecraft ffxiv bad gotcha
250,"['remember', 'wanting', 'cod', 'rc', 'plane', 'plane', 'forget', 'installment']",11547,i remember wanting the cod rc plane just for the plane i forget which installment it was
251,"['holy', 'shit', 'touch', 'take']",11617,holy shit what an out of touch l take 
252,"['forget', 'charizard']",11657,don’t forget charizard
253,"['feel', 'like', 'calling', 'john', 'carmack', 'legit', 'programmer', 'selling', 'bit', 'short', 'haha']",11759,i feel like calling john carmack ‘a legit programmer’ is selling him just a bit short haha
254,"['hexen', 'goat', 'greetings', 'mortal', 'ready', 'die']",11760,hexen is the goat g̵̠̏r̶̮̿ē̷͚ę̶͌t̸̥́ȉ̸͖n̷̗̎g̷̹̈s̴̞̍ ̴̼̿m̵͔̅ȯ̸͚r̸̲̽t̴̮̾ǎ̶͜l̸̥̎ ̸̹́ ̸̭̂ḁ̵̒r̸̦͝e̶̅ͅ ̵͕̃y̷̥̋o̵̡̒u̴͍̒ ̴͉̐r̸̬͗e̵̤̋a̶̡̒d̶̎͜y̵̮͂ ̷̹͐ṯ̸̂o̵͈̐ ̵̳̑d̶͈̆i̴̫͒ẻ̴̼ ̸̻͑
255,['fuck'],11768,the fuck are you on about 
256,"['keep', 'forgetting', 'switch', 'harddrive', 'gb', 'sd', 'card', 'technology', 'weird']",11782,i keep forgetting my switch's harddrive is a gb sd card technology is weird 
257,"['need', 'stop', 'hyperbolic', 'lmao']",11910,no they don't y'all need to stop being so hyperbolic lmao
258,['dunno'],11946,dunno then 
259,"['aka', 'wiiu', 'botw', 'bestest', 'uncle']",12001,aka the wiiu and botw from your bestest uncle ; 
260,"['remember', 'getting', 'ice', 'cube', 'tray', 'made', 'bullet', 'shaped', 'ice', 'cubes', 'johnny', 'gat', 'style', 'glasses', 'sr', 'cufflinks', 'saints', 'row', 'third', 'favourite', 'nba', 'though', 'kobe', 'themed', 'got', 'cap', 'poster', 'trading', 'cards', 'still']",12045,i remember getting an ice cube tray that made bullet shaped ice cubes johnny gat style glasses and sr cufflinks for saints row the third my favourite is nba k though it was kobe themed so i got a cap with on it a poster and trading cards i still have them all too
261,"['mate', 'could', 'said', 'sentences', 'makes', 'come', 'pretentious', 'getting', 'downvotes', 'despite', 'saying', 'anything', 'crazy']",12073,mate you could of said all this in a few sentences it just makes you come off as pretentious which is why you are getting downvotes despite not saying anything crazy 
262,"['gb', 'ram', 'mb', 'integrated', 'graphics', 'laptop', 'ran', 'crysis', 'though', 'smooth', 'fps']",12121,my gb ram mb integrated graphics laptop ran crysis though at a smooth fps 
263,"['nah', 'john', 'romero', 'secretly', 'icon', 'sin', 'noclipped']",12138,nah that was john romero he was secretly the icon of sin if you noclipped into it
264,"['gamecube', 'wii', 'wiiu', 'shared', 'architecture', 'way', 'bit', 'cpu', 'shares', 'architecture', 'processor', 'really', 'call', 'ryzen', 'overclocked', 'athlon']",12144,because he is the gamecube wii wiiu shared the architecture in the same way a bit x cpu from shares the architecture with a processor but you don't really call a ryzen just an overclocked athlon do you 
265,"['bruh', 'fr']",12210,bruh what fr
266,"['yeah', 'switch', 'uses', 'downclocked', 'tegra', 'chip', 'thing', 'nvidia', 'shield', 'worse', 'battery', 'life']",12279,yeah the switch uses a downclocked tegra chip same thing that was in the nvidia shield but worse for battery life 
267,"['fr', 'fr', 'bruh']",12282,fr fr bruh what
268,"['four', 'megabytes', 'ram']",12297,in four megabytes of ram 
269,"['bruh', 'fr', 'sayin', 'bruh']",12331,bruh fr that what i’m sayin bruh
270,"['skyline', 'touch', 'egg', 'ns', 'btw', 'skyline', 'totally', 'free', 'open', 'source', 'iirc']",12351,skyline don't touch egg ns btw skyline is totally free open source iirc
271,"['always', 'wondered', 'managed', 'put', 'people', 'moon', 'computer', 'processing', 'power', 'potato', 'absolutely', 'blows', 'mind']",12361,i've always wondered how we managed to put people on the moon with a computer that has the processing power of a potato that absolutely blows my mind
272,"['nice', 'remember', 'asking', 'lmao']",12427,that's nice and all but i don't remember asking lmao
273,"['oh', 'yes', 'course', 'could', 'forget', 'software', 'old', 'terminals', 'run', 'ps', 'games', 'problem', 'lmao']",12448,oh yes of course how could i forget that it's all about the software that's why old terminals can run ps games no problem lmao
274,"['sooo', 'jealous', 'getting', 'spit', 'tpc', 'lmao']",12469,i'm sooo jealous of you getting spit on by tpc lmao
275,['fuck'],12670,what the fuck
276,"['epic', 'minigames', 'murder', 'mystery', 'hide', 'seek', 'extreme', 'natural', 'disaster', 'survival', 'survive', 'disasters', 'cursed', 'islands', 'icebreaker', 'super', 'bomb', 'survival', 'dodgeball', 'lab', 'experiment']",12712,epic minigames murder mystery hide and seek extreme natural disaster survival survive the disasters cursed islands icebreaker super bomb survival dodgeball lab experiment
277,"['say', 'maybe', 'epic', 'minigames', 'maybe', 'survive', 'disaster', 'game']",12713,i'd say maybe epic minigames maybe a survive the disaster game
278,"['big', 'paintball', 'epic', 'minigames', 'hide', 'seek', 'extreme', 'simon', 'says']",12714,big paintball epic minigames hide and seek extreme simon says
279,['fuck'],13038,fuck yourself
280,"['oh', 'lordy']",13290,oh lordy 
281,['insane'],13483, is insane 
282,"['world', 'headless', 'horseman', 'cosmetics', 'bundle', 'show', 'arrives', 'shalom', 'peace']",13629,what in the world is headless horseman cosmetics bundle that’s you’ll show me when it arrives shalom peace 
283,['fuck'],13703,fuck no
284,"['omg', 'insane']",13946,omg that's insane
285,"['terraria', 'stardewvalley']",14036,no get him terraria or stardewvalley 
286,"['roblox', 'meh', 'yearold', 'playing', 'bit', 'supervised', 'successfully', 'steered', 'back', 'minecraft', 'even', 'working', 'spinning', 'family', 'server', 'heavily', 'modded', 'via', 'curseforge', 'pc', 'gamer', 'try', 'try', 'modded', 'minecraft', 'via', 'curseforge']",14092,roblox is very meh my yearold was playing it for a bit supervised but i've successfully steered her back to minecraft we are even working on spinning up a family server heavily modded via curseforge if you are a pc gamer i'd try to get them to try modded minecraft again via curseforge
287,"['oh', 'goodness', 'minecraft', 'know', 'much', 'either', 'like']",14910,oh goodness minecraft… i don’t know much about it either what’s it like 
288,['omg'],15427,omg 
289,"['true', 'hard']",15497,true it’s just hard 
290,"['controlling', 'fuck', 'return']",15566,that's controlling as fuck return it 
291,"['cell', 'phone', 'work', 'without', 'battery']",15797,cell phone won’t work without a battery 
292,"['oh', 'battery', 'died', 'lost', 'oh']",15880,oh no the battery died and she lost it oh no 
293,"['omg', 'gold', 'good', 'idea']",15890,omg that was gold good idea 
294,"['ol', 'grammy', 'gave', 'dud', 'oh', 'honey', 'nasty', 'bitch']",15952,‘ol grammy gave you a dud oh honey what a nasty bitch ’
295,"['would', 'outdated', 'possibly', 'capable', 'upgrading', 'security', 'antivirus', 'software']",16097,it would be outdated and possibly not be capable of upgrading the security and antivirus software 
296,"['yo', 'screw']",16224,your yo didn't screw up you did 
297,"['eh', 'yo', 'screw']",16238,eh your yo didn’t screw up you did 
298,['screwed'],16294,you screwed up yourself 
299,"['hold', 'login', 'streaks']",16414,hold up login streaks 
300,"['power', 'rangers', 'themed', 'party', 'birthday', 'remember']",16585,i had a power rangers themed party at it's the only birthday i remember
301,"['much', 'better', 'well', 'timed', 'oh', 'biscuits', 'wonder', 'og', 'millennial', 'mom', 'boomer', 'got', 'giggle', 'would', 'quote', 'filbert', 'rocko', 'modern', 'life', 'oh', 'fish', 'sticks']",16999,not much better than a well timed oh biscuits i wonder if my og millennial mom boomer got the same giggle when i would quote filbert from rocko's modern life oh fish sticks 
302,"['right', 'blows', 'mind', 'hahah']",17044,right blows my mind hahah
303,['true'],18411,true
304,"['check', 'minecraft', 'education', 'edition']",18942,check out minecraft education edition 
305,"['stop', 'haha', 'yo', 'stop', 'saying', 'word', 'cabbagey', 'earlier', 'honestly', 'think', 'blank', 'nowadays']",18998,it doesn't stop haha my yo wouldn't stop saying the word cabbagey earlier honestly i think i blank it out nowadays 
306,"['wait', 'hear', 'minecraft']",19009,just wait until you get to hear all about minecraft 😐
307,"['son', 'love', 'godddddd', 'care', 'minecraft']",19088,my son is and i love him but godddddd i don't care about minecraft
308,"['teach', 'sassy', 'backtalk', 'lines', 'throw', 'back', 'lil', 'bitches', 'limited', 'edition', 'unique', 'one', 'kind', 'shoes', 'good', 'regulat', 'converse', 'wearing', 'normies']",19520,teach him some sassy backtalk lines that throw back at those lil bitches those limited edition unique one of a kind shoes are too good for regulat converse wearing normies 💁🏽‍♂️
309,"['think', 'minecraft', 'would', 'better', 'idea']",20213,i think minecraft would be a better idea
310,"['terraria', 'might', 'interest']",20229,terraria might interest him 
311,"['lmao', 'fuck', 'little', 'pony', 'kissing', 'lips', 'turn', 'kid', 'girl', 'actual', 'hell']",20704,lmao fuck off my little pony and you kissing his lips did not turn this kid into a girl what in the actual hell
312,"['omg', 'sick', 'roblox']",20992,omg i'm so sick of roblox 😂😂
313,"['kiddo', 'got', 'first', 'access', 'single', 'player', 'minecraft', 'loved', 'minecraft']",21109,my kiddo got his first at but only with access to single player minecraft he loved minecraft
314,"['bought', 'child', 'protective', 'software', 'laptop']",21134,same then they bought some child protective software for my laptop 
315,"['minecraft', 'inboxes']",21144,minecraft doesn't have inboxes what you on about 
316,"['commands', 'command', 'blocks']",21155,commands command blocks 
317,"['oh', 'duh', 'haha']",21310,oh duh haha 
318,"['minecraft', 'nothing', 'suggest', 'play', 'minecraft', 'without', 'public', 'server', 'micro', 'transactions', 'mods', 'galore', 'great', 'game', 'bonding']",21897,if you're against minecraft there is nothing i can suggest you can play minecraft without being on a public server no micro transactions and mods galore it is a great game for bonding
319,"['nah', 'tablet', 'limited', 'would', 'go', 'laptop']",21949,nah tablet is limited i would go for laptop 
320,"['rocket', 'league']",22333,rocket league
321,"['zelda', 'breath', 'wild', 'pokemon', 'sword', 'shield', 'minecraft', 'slime', 'rancher']",22507,zelda breath of the wild pokémon sword & shield minecraft slime rancher
322,"['feel', 'ya']",22523,i feel for ya ❤️
323,"['stupid', 'word', 'one', 'without', 'underestimate']",22870,the stupid word is one we can all do without and no i don't underestimate him 
324,"['know', 'best', 'buy', 'offeres', 'range', 'heavy', 'hitter', 'celeron', 'processors', 'little', 'ram', 'exactly', 'looking']",22903,i know best buy has had some offeres in that range it's not a heavy hitter celeron processors little ram but that's exactly what were looking for
325,"['someone', 'linked', 'celeron', 'geobook', 'might', 'good', 'one', 'us', 'target', 'like', 'laptop', 'range', 'example']",22906,someone linked a celeron geobook for that might be a good one for us target is like a laptop that we can get in the range for example
