,top words,ID,Text
0,, , 
1,"['good', 'illustration', 'industry', 'needs', 'regulated', 'unadulterated', 'capitalism', 'equals', 'businesses', 'ram', 'rodding', 'everyone']",98,good illustration of why industry needs to be regulated unadulterated capitalism equals businesses ram rodding everyone 
2,"['wait', 'mate', 'bees']",307,wait so you mate bees 
3,"['yeah', 'hold', 'fuck']",442,yeah hold the fuck up
4,"['true', 'idc']",500,its true idc
5,"['nessecarily', 'true']",505,not nessecarily true
6,"['know', 'fuck', 'agree', 'completly']",568,you know what fuck you but i agree completly 
7,"['except', 'bees']",696,except bees
8,"['power', 'bill', 'man', 'power', 'bill']",719,the power bill man the power bill
9,['poop'],744,r poop
10,"['preston', 'care', 'long', 'getting', 'dough', 'lmao']",752,preston wouldn't care as long as he's getting that dough lmao
11,"['non', 'fungible', 'tokens', 'nfts', 'cryptographic', 'assets', 'blockchain', 'unique', 'identification', 'codes', 'metadata', 'distinguish', 'unlike', 'cannot', 'traded', 'exchanged', 'equivalency', 'differs', 'fungible', 'tokens', 'like', 'identical', 'therefore', 'used', 'medium', 'commercial', 'transactions']",791,**non fungible tokens or nfts are cryptographic assets on blockchain with unique identification codes and metadata that distinguish them from each other unlike cryptocurrencies they cannot be traded or exchanged at equivalency this differs from fungible tokens like cryptocurrencies which are identical to each other and therefore can be used as a medium for commercial transactions **
12,['slaves'],808,slaves 
13,"['true', 'true']",833,true true 
14,"['pay', 'win', 'fuck']",841,they're pay to win as fuck
15,['true'],850,true
16,['true'],869,that's true 
17,"['billion', 'hell']",910, billion what the hell 
18,['mate'],967,same here mate
19,"['antivirus', 'enough', 'need', 'protegent', 'worlds', 'antivirus', 'deeta', 'recovery', 'software']",1059,“antivirus is not enough you need protegent worlds only antivirus with deeta recovery software”
20,['true'],1062,that is so true
21,"['antivirus', 'protegent']",1069,the antivirus was protegent
22,"['stern', 'moai', 'invariant', 'commands', 'opt', 'opt', 'delete']",1072,**very stern moai is ** * invariant * *** ^ commands 'opt out' 'opt in' 'delete' 
23,['bruh'],1212,bruh
24,"['gonna', 'lie', 'murder', 'mistery', 'kat', 'sharkbite', 'epic', 'minigames', 'games', 'good', 'yeah', 'natural', 'disasters', 'survival', 'amazing']",1305,not gonna lie murder mistery kat sharkbite epic minigames and other games are good too but yeah natural disasters survival is amazing 
25,"['anyone', 'remember', 'roblox', 'battle', 'remastered', 'back', 'dead', 'servers', 'empty']",1309,anyone remember roblox battle they remastered it back in its dead now the servers are empty
26,"['nah', 'roblox', 'still', 'good', 'playing', 'minecraft', 'remember', 'one', 'deadly', 'sin', 'never', 'buy', 'minecraft', 'bedrock', 'edition', 'phones', 'stuff']",1344,nah roblox is still good but when playing minecraft remember the one deadly sin never buy minecraft bedrock edition phones and stuff 
27,"['omg', 'yas', 'games', 'epic']",1360,omg yas both of those games are epic
28,"['inaccurate', 'forgot', 'devil', 'ice', 'powers', 'youtuber', 'disgraceful']",1380,this is so inaccurate you forgot the devil has ice powers youtuber disgraceful 
29,"['alex', 'rich', 'famous', 'lesbian', 'gay', 'queen', 'pro', 'says', 'bad', 'word', 'half', 'unicorn', 'half', 'demon', 'dont', 'touch', 'tail', 'gold', 'digger', 'cheater', 'russian', 'eats', 'tacos', 'evil', 'angle', 'bad', 'bullied', 'single', 'cuffed', 'youtuver', 'ice', 'powers']",1381,alex rich famous lesbian gay queen pro says bad word half unicorn half demon dont touch my tail gold digger cheater russian eats tacos evil angle bad bullied single cuffed youtuver ice powers 
30,"['oh', 'almost', 'forgot', 'unofficial', 'royale', 'high', 'subreddit', 'nobody', 'likes', 'alex', 'rich', 'lesbian', 'virgin', 'gets', 'bullied', 'wants', 'die', 'single', 'famous', 'queen', 'half', 'rat', 'pegasus', 'unicorn', 'gold', 'digger', 'devil', 'ice', 'powers', 'youtuber', 'people', 'fact', 'make', 'fun', 'lot', 'know', 'sucks', 'search', 'nice', 'people', 'community']",1383,oh and almost forgot there's an unofficial royale high subreddit and nobody on there likes the alex rich lesbian virgin gets bullied wants to die single famous queen of u s a half rat pegasus unicorn gold digger devil has ice powers youtuber people in fact we make fun of them a lot i know it sucks to have to search for nice people in a community 
31,"['john', 'rich', 'famous', 'asexual', 'says', 'bad', 'words', 'half', 'wolf', 'half', 'dolphin', 'creature', 'night', 'leader', 'pack', 'dont', 'touch', 'tail', 'gold', 'digger', 'likes', 'bones', 'kills', 'pigs', 'demon', 'bad', 'single', 'teen', 'youtuber', 'ice', 'powers', 'fire', 'powers', 'use', 'force', 'dodge', 'bullets', 'cant', 'killed', 'tattoos', 'wings', 'furry', 'dresses', 'cool', 'mansion', 'watches', 'jojo', 'plays']",1414,john rich famous asexual says bad words half wolf half dolphin creature of the night leader of the pack dont touch my tail gold digger likes bones kills pigs demon bad single teen youtuber has ice powers has fire powers can use the force can dodge bullets cant be killed has tattoos has wings furry dresses cool has a mansion watches jojo plays on b t
32,"['fuck', 'helpful', 'award']",1755,why the fuck is there a helpful award on this 
33,"['master', 'yoda', 'shall', 'bow']",1792,to you master yoda we shall bow
34,"['mother', 'loving', 'fuck', 'million', 'karma']",1795,how in the mother loving fuck do you get over a million karma 
35,"['fuck', 'roads', 'homies', 'hate', 'roads']",1827,fuck the roads all my homies hate roads 
36,"['one', 'learn', 'powers']",1836,can one learn such powers 
37,"['fuck', 'hoe', 'ass', 'roads']",1841,[fuck them hoe ass roads] 
38,['stfu'],1858,stfu
39,"['bring', 'ketamine', 'inject', 'large', 'dose', 'ketamine', 'die', 'shall']",1862,bring some ketamine too you should inject a large dose of ketamine before we die we shall 
40,['minecraft'],1893,what about minecraft
41,"['fuck', 'epic']",1999,fuck epic
42,"['mean', 'like', 'killing', 'floor']",2177,you mean like killing floor 
43,"['forget', 'dota', 'mod', 'warcraft', 'think']",2295,don't forget dota was a mod for warcraft i think 
44,"['mentally', 'challenged', 'mate']",2317,are you mentally challenged mate 
45,"['wait', 'see', 'deadzone', 'eternal']",2391,wait until you see deadzone eternal 
46,"['forget', 'pedophiles']",2405,don't forget the pedophiles
47,"['replace', 'word', 'devs', 'kids', 'world', 'capitalists', 'rapists', 'described', 'pedophile', 'see', 'point', 'cane', 'replace', 'words', 'whatever', 'want', 'change', 'morality', 'defined', 'specificities']",2459,replace the word devs with kids and the world capitalists with rapists and you just described a pedophile see how that isn't a point we cane replace those words with whatever you want but it doesn't change the morality defined in the specificities 
48,['fuck'],2495,but what about and what about and what about fuck you 
49,"['wonder', 'redditors', 'struggle', 'much', 'concede', 'may', 'understood', 'ego', 'inflated', 'kiddo']",2513,i wonder why do redditors struggle so much to concede that they may have understood why is your ego so inflated kiddo 
50,"['technically', 'illegal', 'wrong', 'asking', 'people', 'say', 'think', 'dying', 'hill', 'twist', 'words', 'around', 'attack', 'pathetic']",2531,it's not technically illegal but it's wrong i'm asking people to say what they think i am not dying on any hill and you just twist my words around to attack me pathetic 
51,"['mean', 'minecraft', 'royale', 'come', 'full', 'circle']",2563,you mean minecraft royale we've come full circle now
52,"['reminds', 'minecraft', 'easter', 'egg', 'borderlands']",2576,reminds me of the minecraft easter egg in borderlands 
53,['rtx'],2580,>rtx off
54,"['like', 'minecraft', 'royale', 'think', 'malfunctioning', 'gpu', 'since', 'trees', 'bushes', 'affected', 'probably', 'manual', 'tweaks']",2602,more like **minecraft royale** and i don't think that's a malfunctioning gpu since only the trees and some bushes are affected probably manual tweaks 
55,"['tbh', 'minecraft', 'battle', 'royale', 'anyone', 'else', 'uhc', 'hunger', 'games', 'mods']",2614,tbh minecraft did battle royale before anyone else did what with the uhc and hunger games mods 
56,"['excuse', 'circles', 'minecraft']",2615,excuse me there’s no circles in minecraft
57,"['servers', 'zoned', 'moved']",2642,some servers had zoned that moved in
58,"['believe', 'amount', 'cores', 'mhz', 'gb', 'dual', 'channel', 'ram', 'getting', 'similar', 'performance', 'man', 'keeps', 'getting', 'confused', 'hate', 'curse', 'lol']",2665,i have a k so i believe we have the same amount of cores and i have mhz gb dual channel ram so we should be getting similar performance man this keeps getting me more and more confused i hate this curse lol
59,"['omg', 'really']",2903,omg really 
60,"['would', 'make', 'good', 'condom', 'commercial']",2917,this would make a good condom commercial
61,['kill'],2953,kill him
62,"['roblox', 'minecraft', 'one', 'fun', 'minecraft', 'roblox']",3091,roblox or minecraft which one is more fun minecraft or roblox why 
63,"['wondering', 'games', 'besides', 'floor', 'lava']",3117,i was wondering if there were more games besides floor is lava
64,"['committed', 'die']",3144,i committed die
65,"['introduce', 'steam', 'terraria', 'especially', 'terraria', 'fuck', 'yeah', 'terraria', 'holy', 'fucking', 'shit', 'terraria', 'motherfucking', 'terraria', 'could', 'try', 'terraria']",3211,introduce them to steam and terraria especially terraria fuck yeah terraria holy fucking shit terraria it's motherfucking terraria how could you not try terraria
66,"['calling', 'power', 'sans', 'undertale']",3216,he's calling on the power of sans from undertale 
67,"['wonder', 'cup']",3220,wonder what's in that cup 
68,"['pc', 'try', 'modded', 'minecraft', 'gave', 'good', 'phone', 'try', 'modded', 'minecraft', 'pojav', 'launcher']",3304,if you have a pc try modded minecraft or if you gave a good phone try modded minecraft on pojav launcher
69,"['widespread', 'something', 'vocal', 'detractors']",3395,the more widespread something is the more vocal its detractors 
70,"['roblox', 'isnt', 'bad', 'cool', 'gsme', 'like', 'remember', 'minecraft', 'always', 'haters']",3518,roblox isnt bad its a cool gsme just like i remember minecraft was but there are always haters
71,"['probably', 'word', 'pray', 'keyword', 'religious', 'aspect']",3631,probably the word pray is a keyword for the religious aspect 
72,"['would', 'ideally', 'want', 'laptop', 'ram', 'also', 'graphics', 'hard', 'hold', 'years', 'come', 'huge', 'battery', 'killer']",3645,you would ideally want a laptop with more ram also the graphics hard will hold up for years to come it is just a huge battery killer 
73,"['terraria', 'better']",3683,terraria is better than both
74,"['roblox', 'free', 'minecraft', 'expensive', 'plus', 'portable']",3688,roblox = free minecraft =too expensive plus not portable 
75,"['minecraft', 'like', 'definitely', 'portable', 'minecraft', 'switch', 'even', 'minecraft', 'pocket', 'edition', 'also', 'pocket', 'edition', 'completely', 'free', 'apk', 'even', 'mod', 'shit', 'know', 'messing', 'idea', 'minecraft', 'expensive', 'portable', 'entirely', 'opposite']",3695,minecraft is like at most and definitely is portable there’s minecraft on switch and even minecraft pocket edition you can also get pocket edition completely for free with apk and even mod the shit out of it if you know what you’re messing with no idea how minecraft is expensive or not portable to you when it’s entirely to opposite 
76,['lmfao'],3762,lmfao
77,"['til', 'isis', 'roblox', 'servers']",3800,til isis has roblox servers
78,"['roblox', 'minecraft', 'would', 'choose', 'minecraft', 'someone', 'particular', 'said', 'minecraft', 'garbage', 'roblox', 'better', 'put', 'answers', 'comments']",3821,roblox or minecraft i would choose minecraft but someone in particular said minecraft was garbage and roblox was better put answers in comments 
79,"['oh', 'look', 'post', 'lets', 'bash', 'roblox', 'praise', 'minecraft']",3824,oh look its this post again lets bash on roblox and praise minecraft again 
80,['minecraft'],3828,minecraft
81,"['even', 'question', 'minecraft']",3830,this ain’t even a question minecraft 
82,"['equally', 'good', 'probably', 'bitching', 'adopt', 'outage', 'yesterday', 'afternoon']",3833,both are equally good they probably bitching because of the adopt me outage yesterday afternoon
83,"['yep', 'sandbox', 'minecraft']",3882,yep it was the sandbox before minecraft was 
84,"['words', 'true', 'prophet']",3896,words of a true prophet 
85,"['minecraft', 'tf', 'talking', 'bout']",3911,its minecraft tf you talking bout
86,"['oh', 'late']",3931,oh that is not late
87,"['roblox', 'suggested', 'minecraft', 'vice', 'versa']",3985,what if roblox suggested minecraft and vice versa
88,"['dae', 'minecraft', 'good', 'fartnite', 'bad']",3988,dae minecraft good fartnite bad 
89,"['cuz', 'minecraft', 'fortnite']",3989,cuz minecraft > fortnite
90,"['maybe', 'forgot', 'punctuation', 'introducing', 'inquiring', 'employment', 'opportunities']",4004,maybe they forgot punctuation and were just introducing themselves and inquiring about employment opportunities
91,"['behind', 'kinda', 'came', 'like', 'eliminates', 'player', 'like', 'son', 'forget', 'teabag']",4149,i can get behind that it kinda came off like he eliminates a player and you're like son don't forget to teabag him 
92,"['ghandi', 'dead']",4166,so was ghandi but they're both dead 
93,"['simple', 'minecraft']",4193,or are you too simple for minecraft 
94,"['fortnite', 'roblox', 'boooom', 'brain', 'explodes']",4252,fortnite in roblox boooom brain explodes
95,"['sorry', 'late', 'wooded', 'creek']",4264,sorry for being late [wooded creek] 
96,"['build', 'house', 'minecraft', 'minecraft', 'like', 'playing', 'legos']",4279,build a house with him in minecraft because minecraft is like playing with legos 
97,"['late', 'mine', 'like', 'like']",4287,too late for mine they like what they like 
98,"['dead', 'space']",4293,dead space
99,"['wrong', 'minecraft']",4294,what is wrong with minecraft 
100,"['minecraft', 'great', 'period']",4310,minecraft is great period 
101,['bruh'],4333,bruh
102,"['one', 'called', 'hyper', 'pixel', 'something', 'forget', 'name', 'nicknamed', 'minecraft']",4342,isn’t there one called hyper pixel or something i forget the name it was nicknamed minecraft 
103,['fuck'],4360,what the fuck why 
104,"['anymore', 'mate']",4372,its not anymore mate
105,"['neither', 'minecraft', 'reigns', 'supreme', 'else']",4375,neither minecraft reigns supreme over all else
106,['minecraft'],4437,minecraft 
107,['minecraft'],4438,minecraft 
108,"['check', 'man', 'sky', 'terraria']",4461,check out no man's sky and terraria 
109,['gtav'],4470,gtav
110,"['part', 'roblox', 'dies']",4502,this is the part where roblox dies
111,['king'],4527,king
112,['fuck'],4613,fuck 😳😳😳
113,"['gb', 'hdd', 'designed', 'either', 'email', 'document', 'typing', 'plain', 'netflix', 'want', 'something', 'space', 'lease', 'gb', 'ssd']",4620,no gb hdd this is designed for either email document typing or just plain netflix you’ll want something with more space at lease gb ssd
114,"['document', 'typing', 'laptop', 'gb', 'storage', 'wont', 'hold', 'anything', 'upgradable']",4624,this is a document typing laptop only gb storage wont hold anything and not upgradable
115,"['need', 'least', 'gb', 'memory', 'much', 'want', 'mods', 'gb', 'nvidia', 'amd', 'gpu', 'also', 'disk', 'space']",4636,need at least gb of memory much more if they want mods gb and an nvidia or amd gpu also more disk space 
116,"['try', 'amd', 'cpu', 'would']",4637,try to get an amd or cpu and it would 
117,"['windows', 'could', 'would', 'awful']",4638,it's windows so it could but it would just be awful
118,"['fuck', 'want', 'play', 'among', 'us', 'play', 'among', 'us']",4674,fuck off if you want to play among us just play among us
119,['fuck'],4676,fuck u
120,"['minecraft', 'steve', 'roasts', 'roblox']",4683,minecraft steve roasts roblox 
121,['gotcha'],4708,gotcha
122,"['raygun', 'survive', 'kill', 'killers', 'roblox', 'wanna', 'know']",4710,how do i get raygun on survive and kill the killers on roblox i just wanna know
123,"['neither', 'terribly', 'graphic', 'intensive', 'able', 'away', 'using', 'integrated', 'graphics', 'unlike', 'comments', 'seem', 'saying', 'assuming', 'arent', 'playing', 'phasmo', 'vr', 'may', 'higher', 'reqs', 'said', 'recommend', 'amd', 'ryzens', 'integrated', 'graphics', 'intels', 'youd', 'looking', 'ryzen', 'integrated', 'graphics', 'ryzen', 'would', 'likely', 'budget', 'higher', 'budget', 'probably', 'could', 'something', 'dedicated', 'graphics', 'instead', 'id', 'spring', 'ryzen', 'since', 'youd', 'working', 'pretty', 'hard']",4716,neither those are terribly graphic intensive so you should be able to get away with using integrated graphics unlike what most of these comments seem to be saying i am assuming you arent playing phasmo vr which may have higher reqs that said i'd recommend amd ryzens integrated graphics over intels so youd be looking for a ryzen or with integrated graphics ryzen would likely be out of your budget and if you had that higher budget you probably could get something with dedicated graphics instead id spring for the ryzen over the if you can since youd be working a pretty hard 
124,['laptop'],4783,what laptop is that 
125,"['realise', 'chromebook', 'come', 'windows', 'install', 'windows']",4785,you realise that this is a chromebook it does not come with windows nor can you install windows 
126,['hell'],4796,what the hell is it then 
127,"['idk', 'manager', 'smth']",4811,idk i am not his manager or smth
128,"['dont', 'forget', 'preorder']",4910,dont forget to preorder
129,"['cod', 'dead', 'since', 'infinite', 'warfare']",4947,cod has been dead since infinite warfare 
130,"['fix', 'servers']",5090,if only they'd fix the servers 
131,"['originally', 'saying', 'fuck', 'buying', 'heard', 'zombies', 'bastards', 'know', 'weakness']",5191,originally i was saying fuck that i'm not buying it but then i heard it has zombies 😭 those bastards know my weakness 
132,"['true', 'think', 'infinite', 'warfare', 'somewhat', 'underrated', 'compared']",5313,true and i think infinite warfare was somewhat underrated compared to what we have now
133,['late'],5323,too late
134,"['hell', 'yeah', 'would', 'lmao']",5467,hell yeah i would lmao 
135,"['skins', 'powers']",5506,what skins have powers 
136,"['wait', 'googles', 'joe', 'pesci', 'voice', 'fuck', 'piece', 'shit']",5512,wait *what * \*googles it\* ** joe pesci's voice ** what the fuck is this piece of shit 
137,"['like', 'funko', 'pops', 'cooler']",5642,what like your funko pops are any cooler 
138,['gotcha'],5650,gotcha
139,"['fuck', 'remember']",5682,fuck i remember that
140,"['kinda', 'miss', 'days', 'could', 'put', 'console', 'small', 'compartment', 'like', 'nes', 'worry', 'overheating', 'haha']",5915,kinda miss the days when i could put a console in a small compartment like your nes is and not have to worry about it overheating haha
141,"['cool', 'fuck']",5960,that's cool as fuck 
142,"['treat', 'pickup', 'retrotink']",6006,treat yourself and pickup a retrotink 
143,"['would', 'take', 'crt', 'retrotink', 'day', 'weak', 'hell', 'take', 'composite', 'crt', 'rgb', 'retrotink']",6018,i would take a crt over retrotink any day of the weak hell i'd take a composite crt over a rgb retrotink 
144,['wait'],6050,wait what 
145,"['half', 'assed', 'minecraft']",6076,it’s half assed minecraft
146,"['roblox', 'predates', 'earliest', 'version', 'minecraft', 'five', 'years', 'fundamentally', 'different', 'purpose', 'minecraft']",6083,no not at all roblox predates the earliest version of minecraft by five years and has a fundamentally different purpose than minecraft 
147,"['late', 'abortion', 'simulator', 'irl']",6134,late abortion simulator but irl
148,"['called', 'modded', 'minecraft']",6154,it’s called modded minecraft
149,"['modded', 'terraria']",6158,modded terraria 
150,"['simple', 'antivirus', 'open', 'program', 'hit', 'scan', 'button', 'look', 'windows', 'defender', 'pc', 'assuming', 'windows', 'operating', 'system']",6179,it's very simple if you have an antivirus you just open the program and hit the scan button if you not then look for windows defender on your pc assuming you have a windows operating system 
151,"['realized', 'profitable']",6253,and now you've realized why it's so profitable 
152,"['omg', 'thought', 'zucks', 'meta', 'verse', 'saw', 'pokemon', 'backpack']",6257,omg i thought this was zucks meta verse but saw the pokémon backpack 💀
153,"['like', 'minecraft']",6495,i too like minecraft
154,"['said', 'profitable']",6524,you said it “most profitable”
155,"['bruh', 'see', 'minecraft', 'graphics', 'profitable', 'game']",6586,bruh have you see minecraft graphics most profitable game 
156,"['profitable', 'development', 'must', 'cheap']",6596,it’s so profitable because the development must be so cheap… 
157,"['minecraft', 'exists', 'hold', 'beer']",6817,minecraft *exists* hold my beer 
158,"['suckered', 'lmao', 'sincerely', 'long', 'burnt', 'fan']",6834,suckered a g a i n lmao sincerely a long burnt fan
159,"['mobile', 'cpu']",6872,it’s on a mobile cpu from 🤓
160,"['bitches', 'stop', 'bitches']",6951,when will you bitches stop being bitches 
161,['minecraft'],6961,is this minecraft
162,"['feel', 'minecraft']",6984,how do you feel about minecraft 
163,"['wow', 'profitable', 'minecraft', 'merch']",7069,wow more profitable than minecraft is that because of merch 
164,"['wait', 'textures', 'fr']",7072,wait are those textures fr 
165,"['convinced', 'never', 'touched', 'ps']",7093,i'm convinced y'all have never touched a ps 
166,"['forget', 'camera', 'collision', 'seeing', 'buildings', 'ground']",7104,don't forget the camera collision and seeing through buildings and the ground
167,"['thats', 'stays', 'profitable']",7129,thats how it stays so profitable
168,['minecraft'],7135,is this minecraft 
169,"['relax', 'bitch', 'make', 'something', 'better', 'stfu']",7213,relax bitch make something better or stfu 
170,"['lol', 'profitable']",7220,lol this is why they're profitable
171,"['like', 'everybody', 'forgot', 'minecraft']",7312,and just like that everybody forgot minecraft 
172,"['thought', 'metaverse', 'legs']",7351,i thought this was the metaverse but now with legs
173,['minecraft'],7374,is that minecraft 
174,"['profitable', 'reason']",7515,it's profitable for a reason 
175,"['thought', 'metaverse', 'second', 'lmao']",7536,i thought this was the metaverse for a second lmao
176,"['lmao', 'play', 'buy']",7583,lmao just don’t play buy it
177,"['fuck', 'though', 'ad', 'smear', 'meta']",7591,fuck me i though this was an ad smear for meta
178,"['think', 'profitable']",7631,why do you think it is the most profitable 
179,['profitable'],7663,that’s why it’s the most profitable 
180,['true'],7743,true 
181,['profitable'],7776,that's why it's the most profitable
182,['minecraft'],7807,minecraft
183,"['wait', 'access', 'metaverse']",7914,wait how did you get access to the metaverse 
184,"['pokemon', 'died', 'moved', 'switch', 'afford', 'one']",7924,pokemon died for me when they moved it to the switch i can’t afford one and then they did this to it 
185,"['fits', 'right', 'meta', 'verse']",7940,fits right into meta's verse
186,"['ps', 'brought', 'us', 'metal', 'gear', 'solid', 'fucking', 'snake', 'eater', 'ya']",7944,the ps brought us metal gear solid fucking *snake eater* ya’ll 
187,"['ok', 'fuck', 'care', 'much', 'godamn', 'stone', 'fence']",7964,ok but why the fuck do you care so much about a godamn stone fence
188,"['dq', 'viii', 'ps', 'looks', 'significantly', 'impressive']",8017,dq viii on ps looks significantly more impressive
189,"['naruhodo', 'korewa', 'nintendo', 'shitchu', 'pawa', 'da', 'see', 'power', 'nintendo', 'shitch', 'japanese']",8070,naruhodo korewa nintendo no shitchu no pawa da i see so this is the power of the nintendo shitch but in japanese 
190,['minecraft'],8090,minecraft 
191,"['surprise', 'smartwatch', 'processing', 'power', 'switch']",8117,no surprise my smartwatch has more processing power than the switch…
192,"['wow', 'finally', 'added', 'legs', 'metaverse']",8184,wow they finally added legs to the metaverse
193,"['wait', 'bunch', 'dudes', 'milling', 'around', 'walmart', 'electronics', 'department', 'crack', 'freaking', 'dawn', 'morning']",8258,wait *this* is why a bunch of dudes were milling around a walmart electronics department at the crack of freaking dawn the other morning 
194,"['hahhaah', 'yer', 'right', 'ps', 'game', 'chipped', 'chipped', 'chipped', 'everyone', 'ps']",8314,hahhaah yer right ps game chipped chipped chipped that's why everyone had a ps and 
195,"['least', 'character', 'legs', 'meta']",8391,at least your character has legs *meta*
196,"['mf', 'unity', 'fucking', 'years', 'ago']",8427,mf i did this in unity fucking years ago
197,"['crt', 'hide']",8556,and no crt to hide it 
198,"['fuck', 'buy']",8567,then why the fuck did you buy it 
199,"['profitable', 'reason']",8570,it's profitable for a reason
200,"['bruh', 'phase', 'one']",8595,bruh it’s phase one 😭😭
201,['metaverse'],8630,is this the metaverse 
202,['profitable'],8662,that's why it's so profitable
203,"['thought', 'metaverse', 'first', 'lmao']",8747,o thought it was the metaverse at first lmao
204,"['borderlands', 'except']",8892,and all the borderlands except 
205,"['thought', 'screenshot', 'metaverse']",9009,i thought it was a screenshot of the metaverse 💀
